{
  "schema_version": "0.1.0",
  "titulo": "Ciclo XXII — Meio-Demônios: famílias, corpo, memória e escolhas",
  "estado": "expansao_cultural_proposta",
  "aprovacao_autoral": false,
  "efeito_canonico_automatico": false,
  "povo": "Meio-Demônios",
  "referencia_cosmologica": "Ascendência demoníaca em mistura com outros povos; demônios, diabos, cambions e tieflings não são espécies cosmológicas separadas.",
  "marco_cronologico_documentado": "983 EC: invasão demoníaca; não equivale à data de origem de todas as linhagens.",
  "patria_unica_documentada": null,
  "governo_comum_documentado": null,
  "aparencia_uniforme_documentada": null,
  "fonte_manuscrito": "fontes/autoria/hack-carcaca-dw-capitulo-i.paginas.json",
  "fatos_documentados": [
    {
      "id": "worldbuilding-xxii:fato:01",
      "pagina": 21,
      "afirmacao_de_fonte": "Meio-Demônio é termo amplo para descendentes de ascendência demoníaca misturada a humanos, elfos, orcs, hobbits e outros povos.",
      "estatuto": "manuscrito_em_revisao",
      "novo_canon": false
    },
    {
      "id": "worldbuilding-xxii:fato:02",
      "pagina": 21,
      "afirmacao_de_fonte": "Demônios, diabos, cambions e tieflings não constituem naturezas cosmológicas separadas na Carcaça; diferem em origem, mistura, aparência, poder ou proximidade ancestral.",
      "estatuto": "manuscrito_em_revisao",
      "novo_canon": false
    },
    {
      "id": "worldbuilding-xxii:fato:03",
      "pagina": 21,
      "afirmacao_de_fonte": "A presença de linhagens mistas se tornou mais comum após grandes invasões demoníacas vindas do Abismo; nem toda linhagem começou numa única invasão.",
      "estatuto": "manuscrito_em_revisao",
      "novo_canon": false
    },
    {
      "id": "worldbuilding-xxii:fato:04",
      "pagina": 21,
      "afirmacao_de_fonte": "As origens incluem violência de guerra, pactos, cultos, alianças, relações consentidas e convivência de gerações; algumas origens se perderam no tempo.",
      "estatuto": "manuscrito_em_revisao",
      "novo_canon": false
    },
    {
      "id": "worldbuilding-xxii:fato:05",
      "pagina": 21,
      "afirmacao_de_fonte": "Traços físicos podem incluir chifres, cauda, cascos, olhos incomuns, asas atrofiadas, escamas e marcas sobrenaturais; outros indivíduos podem parecer mortais sem tais traços.",
      "estatuto": "manuscrito_em_revisao",
      "novo_canon": false
    },
    {
      "id": "worldbuilding-xxii:fato:06",
      "pagina": 21,
      "afirmacao_de_fonte": "A intensidade dos traços físicos não define poder, moralidade nem proximidade genealógica.",
      "estatuto": "manuscrito_em_revisao",
      "novo_canon": false
    },
    {
      "id": "worldbuilding-xxii:fato:07",
      "pagina": 21,
      "afirmacao_de_fonte": "Sangue demoníaco não determina caráter ou lealdade ao Abismo.",
      "estatuto": "manuscrito_em_revisao",
      "novo_canon": false
    },
    {
      "id": "worldbuilding-xxii:fato:08",
      "pagina": 21,
      "afirmacao_de_fonte": "Medo e estigma levam alguns indivíduos a esconder traços e outros a exibi-los; há famílias em cidades cosmopolitas, comunidades refugiadas e proximidades do Abismo.",
      "estatuto": "manuscrito_em_revisao",
      "novo_canon": false
    },
    {
      "id": "worldbuilding-xxii:fato:09",
      "pagina": 21,
      "afirmacao_de_fonte": "Em alguns assentamentos próximos do Abismo a ascendência demoníaca é socialmente comum e reconhecida sem espanto.",
      "estatuto": "manuscrito_em_revisao",
      "novo_canon": false
    },
    {
      "id": "worldbuilding-xxii:fato:10",
      "pagina": 21,
      "afirmacao_de_fonte": "Algumas linhagens manifestam afinidade com fogo, sombras, sonhos, venenos ou magia, enquanto outras têm somente marcas físicas.",
      "estatuto": "manuscrito_em_revisao",
      "novo_canon": false
    },
    {
      "id": "worldbuilding-xxii:fato:11",
      "pagina": 21,
      "afirmacao_de_fonte": "Características ancestrais podem desaparecer por gerações e reaparecer em crianças.",
      "estatuto": "manuscrito_em_revisao",
      "novo_canon": false
    },
    {
      "id": "worldbuilding-xxii:fato:12",
      "pagina": 21,
      "afirmacao_de_fonte": "Indivíduos e famílias divergem entre vergonha, veneração, pesquisa de origem e recusa de definir a própria identidade por ancestrais.",
      "estatuto": "manuscrito_em_revisao",
      "novo_canon": false
    },
    {
      "id": "worldbuilding-xxii:fato:13",
      "pagina": 21,
      "afirmacao_de_fonte": "Alguns indivíduos buscam deliberadamente poderes do Abismo e podem reivindicar direitos ancestrais reais ou supostos; isso não representa todos os descendentes.",
      "estatuto": "manuscrito_em_revisao",
      "novo_canon": false
    },
    {
      "id": "worldbuilding-xxii:fato:14",
      "pagina": 9,
      "afirmacao_de_fonte": "A cronologia do manuscrito registra uma invasão demoníaca em 983 EC, mas ela não data todas as linhagens meio-demoníacas.",
      "estatuto": "manuscrito_em_revisao",
      "novo_canon": false
    }
  ],
  "limites": [
    "Não separar demônios, diabos, cambions e tieflings em naturezas cosmológicas diferentes.",
    "Não inferir caráter, alinhamento, poder, profissão, culto ou lealdade por ascendência, traço corporal ou intensidade de magia.",
    "Não datar todas as linhagens em 983 EC: o manuscrito afirma que houve aumento após grandes invasões, não origem universal.",
    "Não atribuir violência, culto, pacto ou relação consensual individual a famílias específicas sem evidência.",
    "Não exigir que filhos respondam por pactos, crimes, guerras ou escolhas religiosas de ancestrais.",
    "Não tratar a manifestação tardia de traços físicos como profecia, prova de maldição ou título nobiliárquico.",
    "Não criar nação, capital, comando ou religião de meio-demônios com base numa categoria genealógica.",
    "Não inventar aldeias ou coordenadas perto do Abismo; comunidades são descritas genericamente.",
    "Não confundir temer discriminação com criminalidade ou com serviço ao Abismo.",
    "Não tratar pessoas de culturas mortais distintas como um povo culturalmente idêntico só por terem ascendência semelhante.",
    "Não homologar rito, lei, escola, evento de violência ou NPC a partir de vinhetas e exemplos condicionais.",
    "Não alterar a ficha de sete criaturas canônicas, mapas, regras de DW ou a fila de decisões do Ciclo XIX."
  ],
  "contagens": {
    "fatos": 14,
    "eixos_sociais": 11,
    "contextos_de_convivencia": 6,
    "circuitos_civis": 6,
    "tensoes": 6,
    "costumes_candidatos": 4,
    "vinhetas": 4,
    "perguntas": 9
  },
  "eixos_sociais": [
    {
      "id": "worldbuilding-xxii:eixo:linhagem-e-pertencimento",
      "nome_editorial": "De quem é uma história de família?",
      "hipotese_social": "A genealogia pode registrar tanto cuidado quanto coerção; conhecer uma origem não significa dever satisfação pública a ninguém.",
      "detalhe_cotidiano": "Uma pessoa só conhece sua avó não demoníaca; os vizinhos exigem genealogia do outro ramo.",
      "pergunta_etica": "Quem pode exigir prova de ascendência e com qual finalidade?",
      "estado": "proposta_nao_canonica",
      "lei_confirmada": false,
      "ocorreu": false
    },
    {
      "id": "worldbuilding-xxii:eixo:familias-plurais",
      "nome_editorial": "O parentesco que não cabe em uma categoria",
      "hipotese_social": "Uma casa com ascendências humanas, órquicas, feéricas e demoníacas não precisa escolher uma raça para ser considerada família.",
      "detalhe_cotidiano": "Um sobrenome de origem mortal é tratado como menos autêntico que um chifre.",
      "pergunta_etica": "Quem representa a família diante de costumes diferentes?",
      "estado": "proposta_nao_canonica",
      "lei_confirmada": false,
      "ocorreu": false
    },
    {
      "id": "worldbuilding-xxii:eixo:infancia-e-tracos",
      "nome_editorial": "Uma criança não é um presságio",
      "hipotese_social": "Traços que reaparecem após gerações poderiam provocar medo, deslumbramento ou novas obrigações impostas ao bebê.",
      "detalhe_cotidiano": "Um adulto deseja exibir publicamente os sinais de uma criança que não pode consentir.",
      "pergunta_etica": "O interesse dos parentes na linhagem vale mais que a segurança da criança?",
      "estado": "proposta_nao_canonica",
      "lei_confirmada": false,
      "ocorreu": false
    },
    {
      "id": "worldbuilding-xxii:eixo:nomes-e-identidade",
      "nome_editorial": "O nome que a pessoa escolheu",
      "hipotese_social": "Termos aplicados por estranhos e nomes herdados podem coexistir com a autoidentificação de cada pessoa.",
      "detalhe_cotidiano": "Um vizinho insiste em chamar alguém de tiefling porque assim aprendeu noutro mundo.",
      "pergunta_etica": "Quem pode determinar o nome social de um descendente?",
      "estado": "proposta_nao_canonica",
      "lei_confirmada": false,
      "ocorreu": false
    },
    {
      "id": "worldbuilding-xxii:eixo:corpo-e-acessibilidade",
      "nome_editorial": "A cidade não foi feita para esta cauda",
      "hipotese_social": "Traços físicos diversos podem exigir adaptações de vestuário, mobiliário e ferramentas sem converter diferenças em deficiências universais.",
      "detalhe_cotidiano": "Uma oficina só produz capacetes rígidos que não se ajustam aos chifres de um aprendiz.",
      "pergunta_etica": "A adaptação é dever de quem usa, fabrica ou contrata?",
      "estado": "proposta_nao_canonica",
      "lei_confirmada": false,
      "ocorreu": false
    },
    {
      "id": "worldbuilding-xxii:eixo:trabalho-e-estigma",
      "nome_editorial": "O emprego antes do sobrenome",
      "hipotese_social": "Habilidade profissional não deriva de herança demoníaca; preconceitos ou fetichização podem moldar acesso ao trabalho.",
      "detalhe_cotidiano": "Um ferreiro é aceito apenas quando o patrão precisa de alguém supostamente resistente ao fogo.",